Lien,Poste,Typedecontrat,Entreprise,Departement,Region,Description,Salaire
https://fr.indeed.com/viewjob?jk=cf24898a3c84401b,DATA SCIENTIST,CDI,Club Med,75,Île-de-France,"Pour accompagner le Club Med dans sa transformation Data, l'équipe Database recherche actuellement son/sa futur(e) Data Scientist Senior.
Ce projet multidimensionnel a pour objectif de délivrer de la Valeur Business, augmenter les capacités data & IA et encourager l’innovation :
Construction d’une architecture data modulable dans un environnement cloud
Création d’un Data Excellence Center pour réunir dans une même dynamique les talents business, data & IT
Missions
Être partenaire de l’ensemble des métiers (ventes, marketing, opérations, …) :
Communiquer et échanger avec les équipes métier afin de comprendre leurs problématiques et collecter leurs besoins
Trouver des solutions à leurs besoins grâce à l'analyse de données avec une vision de la solution pragmatique allant du Quick Win aux projets à long terme
Assurer des ateliers avec le métier pour présenter les résultats et s’assurer de l’adoption des solutions proposées
Exploitation des data disponibles dans la Data Factory :
Identifier et implémenter les approches scientifiques et analytiques pertinentes (algorithmes de Machine Learning, optimisation sous contraintes, …)
Maintenir en condition opérationnelle les modèles de Machine Learning et les faire évoluer si besoin
Définir le plan stratégique des entraînements des modèles de Machine Learning en production
Définir le plan de déploiement en production à grande échelle des solutions
Concevoir des produits d'analyse de données en libre-service (data-as-a-service) pour faciliter l'exploitation de la donnée par les équipes métiers
Veille technologique et stratégique :
Réaliser des POC pour tester de nouvelles méthodologies
Partager en interne les innovations et avancées dans le domaine du Machine Learning / IA
Assurer des codes reviews pour partager les bonnes pratiques aux équipes
Faire monter en compétence un data scientist junior
Profil
Expérience requise : expérience significative d’au moins 4 ans
Vous avez la conviction que la donnée à toute son importance, et pensez qu’elle est à mettre en regard des besoins métiers.
Vous aimez la donnée et êtes pragmatique
Vous avez le sens de l’écoute et aimez partager
Les sujets technologiques vous passionnent, vous êtes à l’aise pour conseiller voire challenger les demandes de vos clients internes
Diplôme : Bac +5 en école d’ingénieur/université spécialisée en Informatique et Gestion de la donnée et de la Data Science
Compétences requises :
Vous disposez de solides compétences scientifiques et techniques sur les principaux algorithmes (ensemble, boosting, réseaux de neurones, deep learning, …)
Vous êtes expérimenté(e) sur les technologies Python et Jupyter
Vous êtes expérimenté(e) sur l’écosystème Cloud GCP (Bigquery, Cloud functions, Cloud Storage, AutoML) - Certification GCP serait un plus
Vous avez des expériences en méthode agile (sprint planning, sprint démo, git, gitlab, CI/CD)
Vous êtes autonome, pro actif et force de propositions
Vous êtes à l’aise en anglais
Modalités
Poste basé au siège du Groupe Club Med à Paris, La Villette (19ème)
Tous nos postes sont ouverts aux personnes en situation de handicap
Avantages en nature ""Vacances G.O"" pour tous nos postes en CDI avec un an d'ancienneté : vacances dans nos Resorts Club Med à tarif très préférentiel pour le/la salarié(e) et sa famille ou un accompagnant de son choix
Politique télétravail actuelle : 2 jours / semaine en accord avec l'équipe ; possibilité de poser une semaine complète tous les 4 mois
You will work in Offices
You'll be working in multi-cultural and considerate teams
You’ll be a key player in your own professional development thanks to a strong policy of internal and international mobility
You’ll be part of creating unforgettable moments for our clients and our teams at the Resorts
You'll develop your skills by participating in the ambitious projects of a company looking to the future and innovation",
https://fr.indeed.com/viewjob?jk=65aca9d6c092ccb7,DATA ANALYSTE,CDI,Byredo,75,Île-de-France,"ABOUT BYREDO

""Beauty can be many things to many people. Our job is to inspire people to be themselves."" Ben Gorham, Founder of Byredo.
The European luxury brand BYREDO was founded in Stockholm in 2006, with an ambition to translate memories and emotions into products and experiences.
BYREDO creates and develops a range of products such as fragrance and make-up but also ByProducts, the brand category for any non-beauty projects.
BYREDO is reinventing the world of luxury through a new approach, where creation is led by emotions, expressing a full and limitless brand universe.
BYREDO is sold in more than 40 countries in a very high-end exclusive network worldwide, with a growing presence online and a strong focus on Ecommerce activities.
We believe that through creativity, we’re able to develop timeless products, both meaningful and inspirational, to people and their lives.
We believe that only great people can design & bring those beautiful projects to life.
We believe in talents vs profiles, in experience vs education, in diversity vs boundaries.
We believe that only powerful teams can lead together the growth of the company, and therefore, we are highly committed to our people.
At BYREDO we come as we are, with the intention to learn from each other and go beyond business objectives.
ABOUT THE JOB
Building strong customer relationship is a key objective within BYREDO’s fast-growing strategy. Within the global eCommerce and CRM team, under the responsibility of the Global CRM Manager, our future Data Analyst will contribute to leverage omnichannel client knowledge and boost customer engagement and retention in a scalable way. You will provide customer analysis and recommendations on how to better interact with our customers to meet our growth targets, and drive insight from our marketing campaigns.
Your experience with data analytics together with business and client understanding will have a big impact on the company's performance. The successful candidate will be comfortable with challenges, with strong communication skills and the ability to adapt to a fast-growing environment.
WHAT YOU WILL DO
Your work will span across creating ad-hoc insights & visualization, streamlining analysis processes, and setting up and maintaining dashboards and performance monitoring.
Combining marketing and technical understanding, you will present complex analysis to a wide range of business stakeholders from international and local teams and translate business questions into meaningful analytics.
You will participate to build client knowledge across the whole organization, develop segmentations and scoring and provide recommendations to improve marketing automation, acquisition models and loyalty mechanisms.
You will analyze the full customer lifecycle to provide business opportunities and increase lifetime value.
You will collaborate with IT teams to set-up automated dashboards and maintain client data governance.
This is a non-exhaustive list.
Your key interlocutors for all of the above:
Global eCommerce team
IT teams
WHAT WE’RE LOOKING FOR IN OUR NEXT TEAM MEMBER
You have strong analytical skills together with the ability to deliver clearly key take outs.
You have great relationship skills and are passionate about making the difference at a key stage of BYREDO’s development.
You are fluent in English.
WHAT WE EXPECT YOU TO BRING TO BYREDO
You have 3 to 5 years proven experience in client data or data analytics in a business oriented role.
You have a degree in Economics, Finance, Statistics, Mathematics, Business Analytics, or similar quantitative discipline.
You are proficient in excel.
You have past experiences with dashboarding and/or data visualization tools (Power BI is a plus), and having a scripting experience (e.g. SQL) is a plus.
OUR COMMITMENT TO YOU
We will onboard you in our fantastic sensorial adventure.
You will work in a flexible and agile working environment, surrounded by great people.
We strongly encourage test & learn mindsets.
You will be able to know your impact and measure your success.
This is a permanent position. Start date: July 2022.
Please make sure to send your CV in English.
-
A PROPOS DE BYREDO
La maison de luxe suédoise BYREDO est fondée en 2006 par Ben Gorham comme projet créatif autour des odeurs et de la mémoire.
BYREDO cherche à réinventer le monde du luxe de par son approche, où la création est menée par les émotions, laissant s’exprimer un univers de marque à la fois complet et infini.
Se démarquant par son élégance contemporaine, son esthétique épurée et le soin tout particulier apporté à la fabrication, le catalogue BYREDO est composé de bougies et de parfums, de maquillage, ainsi que d’une collection de sacs à main et d’accessoires en cuir.
BYREDO est aujourd’hui distribué dans 40 pays et est devenue une véritable référence dans l’industrie du luxe.
Nous pensons que par la créativité nous pouvons développer des produits intemporels, à la fois porteurs de sens et inspirants pour nos clients.
Au sein de l'équipe Global eCommerce, sous la responsabilité du Global CRM Manager, notre Data Analyst aura pour missions d'exploiter la data client sur l'omnicanal et maximiser l'engagement et la rétention client. Vous serez en charge de réaliser des analyses sur la data client et produire des recommandations liées à l'amélioration de nos interactions avec nos clients pour atteindre nos objectifs de croissance et de notre connaissance de nos clients.
MISSIONS
Réaliser des analyses ad-hoc et standardiser les processus d'analyse, implémenter des dashboards et suivre les dashboards de performance.
En combinant une approche marketing et technique, présenter des analyses complexes à différentes parties prenantes au sein de l'entreprise sur un périmètre international et traduire des sujets liés au business en des analyses impactantes.
Participer au développement de la connaissance de nos clients avec d'autres parties prenantes de l'entreprise pour approfondir les segmentations et apporter des recommandations pour automatiser les actions marketing et de fidélité, et les modèles d'acquisition.
Analyser le cycle de vie entier du client pour identifier des opportunités business et maximiser la ""customer lifetime value"".
Collaborer avec les équipes IT pour implémenter des dashboards automatisés et maintenir une gouvernance data client.
Cette liste est non-exhaustive.
PROFIL
Vous avez une expérience de 3 à 5 ans en Data client, Data Analyse dans un environnement à forte orientation business.
Vous avez une formation académique en Economie, Finance, Statistiques, Mathématiques, Business Analytics ou dans une autre discipline quantitative.
Vous maitrisez Excel parfaitement.
Vous avez de l'expérience avec l'implémentation de dashboards et d'outils de présentation de date (la maitrise de Power BI est un plus), et une expérience en scripting (comme SQL) est un vrai plus.
Vous avez de de bonnes capacités d'analyse et vous êtes capable de délivrer des conclusions de façon claire et pertinente.
Vos capacités relationnelles et votre motivation à contribuer au développement de BYREDO à un moment clé dans l'évolution de l'entreprise sont de véritables atouts.
Ce poste est à pourvoir en CDI. Date de démarrage: Juillet 2022.
Merci de postuler en envoyant votre CV en anglais.",
https://fr.indeed.com/viewjob?jk=477fd38a4ba2b2ca,CONSULTANT,CDI,Micropole,92,Île-de-France,"En résumé :

Poste : Consultant Data Visualisation confirmé (F/H)
Localisation : Levallois-Perret
Type de contrat : CDI
Niveau d’expérience : au minimum 5 ans

Vous êtes passionné(e) par la data ? Vous êtes convaincus que l’optimisation du patrimoine data des entreprises est la clé de leur performance ? Vous voulez rendre les entreprises data intelligentes et les aider à se transformer pour préparer dès à présent leur futur ?

Vous souhaitez rejoindre un groupe pionnier des grandes innovations data et digitales ?

Si vous avez répondu « Oui » à chacune de ces questions alors devenez Consultant(e) Data Visualisation pour l’un de nos clients grands-comptes dans les secteurs du luxe/retail, de la banque/assurance, de l’industrie ou du service.

Prêt(e) à rejoindre l’aventure Micropole ? N’attendez plus !

En tant que Consultant(e) Data Visualisation confirmé(e) :
Vous rejoignez notre entité Data Intelligence, basée à Levallois-Perret et composée de 90 #InnovativePeople. En tant que Consultant(e) confirmé(e), vous accompagnerez les directions métiers dans la mise en œuvre de projets Data leur permettant d’optimiser leur performance et serait rattaché(e) à l'équipe "" Microsoft Data Platform », reconnue pour son expertise autour des technologies Microsoft Power Platform et des solutions Analytics du Cloud Azure.

Selon votre parcours orienté technique ou conseil, vous pourrez accompagner nos clients sur :


Les aspects fonctionnels ainsi que sur la mise en place de plateformes techniques répondant à leur besoin ;
Leurs stratégies d’intégration de données ou problématiques métiers liées au reporting.

Dans vos missions quotidiennes, vous serez amené(e) :

Cadrage de projet, proposition de solution, proof of concept ;
Réalisation : conception technique, développement, test ;
Accompagnement du métier : formation, montée en compétence, assistance ;
Encadrement des profils juniors de l’équipe.

Vos compétences techniques :

Vous maîtrisez les principaux outils de data visualisation tels que PowerBI, Looker, QlikSense ou Tableau… ;
Votre parcours vous a permis de développer des compétences autour de PowerApps et PowerAutomate ;
Vous développez vos compétences autour du Cloud Azure (Data Factory, Databricks, Azure Analytics Services) ;
Vous êtes sensibilisé(e) aux méthodes de modélisation des données ;
Vous êtes à l’aise dans le développement de dashboard pour la rédaction de spécifications fonctionnelles, le développement d’indicateurs,etc…

Vos atouts :

Vous avez au moins 5 ans d’expérience professionnelle sur des projets data, et connaissez les différentes briques d’un SI décisionnel ;
Vous maîtrisez les concepts de la data visualisation et disposez d’une d’expérience projet sur une des solutions leaders du marché ;
Véritable coéquipier(e), vous avez à cœur de contribuer à la montée en compétence de votre équipe ;
Vous possédez des capacités relationnelles et d’autonomie, un goût pour le challenge, une aisance rédactionnelle et orale ;
Enfin, vous disposez d’un bon niveau de français et d’anglais, à l’oral comme à l’écrit.

Devenir #INNOVATIVEPEOPLE, c’est :

Intégrer une communauté de 1100 experts passionnés répartis entre la France, la Belgique, le Luxembourg, la Suisse, l’Espagne et la Chine ;
Construire ensemble les solutions stratégiques et innovantes de demain pour accompagner nos clients dans leur transformation data et digitale ;
Participer au développement de nos 4 centres d’excellences cloud : AWS, Microsoft, Salesforce, GCP ;
Evoluer continuellement au travers de formations et de certifications sur les plus grandes technologies grâce à Micropole Campus.
S’assurer d’une innovation continue grâce à : notre écosystème de partenaires technologiques ; notre accélérateur de start’up databoost’R ; nos lieux d’innovations « innovativeSpaces » et de co-construction avec les clients notre management par les talents naturels.

Le processus de recrutement :
Chez Micropole, le processus de recrutement est réactif et transparent.


Etape 1 – Si votre profil correspond à nos besoins, vous êtes recontactés dans les 72 heures qui suivent votre candidature par notre Talent Specialist Marie dédiée à Data Intelligence pour une qualification téléphonique ;
Etape 2 - Un premier entretien est programmé avec Marie en physique ou visio ;
Etape 3 – Vous rencontrez un manager technique avec l’un de nos experts Data Sabine, Sébastien, Bruno, Maria, Farès ou Thomas.

En fonction du poste, vous pouvez passer des étapes supplémentaires (entretien ou test technique).

La vie chez Micropole, c’est :

Une vie interne rythmée pour se familiariser à la culture d’entreprise et aux valeurs de Micropole ;
Des évènements internes réguliers pour partager les connaissances aussi bien techniques que fonctionnelles ;
Une politique de formation attractive et éclectique ;
Un travail en équipe valorisé pour une meilleure cohésion ;
La participation à des projets internes sur la base du volontariat.

À PROPOS DU GROUPE MICROPOLE

Groupe international de conseil et technologies innovantes, MICROPOLE est spécialisé dans les domaines de la Data & Digital. Depuis ses 14 agences situées en Europe et en Chine, les 1100 #INNOVATIVE PEOPLE du Groupe (consultants, data scientists, architectes IT, experts métiers, ingénieurs, UX designers…) accompagnent leurs clients partout dans le monde sur l'ensemble des phases de leurs projets, du conseil à leur réalisation, et sur la conduite du changement.

MICROPOLE réalise 35% de son chiffre d’affaires à l’international et est coté sur le marché Eurolist compartiment C d’Euronext Paris, segment Next Economy.

Pour en savoir plus : https://www.linkedin.com/company/micropole/

\#LI-YL1",
https://fr.indeed.com/viewjob?jk=34c09d1b81cd4b2e,CONSULTANT,CDI,Talan,75,Île-de-France,"Company Description
Talan Solutions est l’entité du groupe dédiée au conseil et à l’intégration autour des solutions technologiques.
Spécialiste du domaine de la gestion et de l’exploitation de la donnée, Talan Solutions développe et met à disposition de ses clients des expertises fonctionnelles, méthodologiques et techniques afin de les accompagner tout au long du cycle de vie d’un projet de transformation digitale.
Nos interventions se focalisent autour des problématiques de Business Intelligence, EPM, Big Data, Data Science, Intelligence Artificielle, MDM, d’accompagnement de la relation client (CRM), de gestion de contenus digitaux (applications mobiles, CMS, développement Web, etc.) et de gestion des données d’entreprise (ERP, EAM, ITSM, etc.).
L’organisation en équipes spécialisées et dédiées à une problématique permet à nos ressources de développer un haut niveau de savoir-faire. Nous sommes ainsi capables d’adresser toutes les étapes d’un projet : des phases amonts (cadrage, choix d’outils, etc.) jusqu’au maintien en conditions opérationnelles en passant par toutes les phases de modélisation, de développement, de recette, de mise en exploitation et d’accompagnement au changement.
Les différents partenariats nous accordent une position de partenaire privilégié. Cela nous permet, entre autre, d’accompagner nos consultants à travers des formations directement auprès des éditeurs, de se certifier continuellement, et ainsi de développer les meilleures compétences sur le marché.

Job Description
Si vous recherchez un univers 100% Data, bienvenue au sein du pôle Data Intelligence Solutions - LE pôle Data du groupe Talan !

Notre aventure a commencé il y a plus de 13 ans, avec l’ambition d’apporter une expertise pointue à nos clients, en couvrant tout le cycle de vie de la Data : les aider à collecter, exploiter, stocker, organiser, visualiser la richesse de leurs gisements de données, analyser leur business d’aujourd’hui, pour prédire celui de demain.
13 ans plus tard, nous voilà partenaires gold de nombreux éditeurs (Microsoft, IBM..), avec plus de 300 consultant(e)s en région parisienne, accompagnant nos clients grands comptes et PME, sur l’ensemble des secteurs, ce qui fait de notre pôle, un acteur de référence dans notre domaine.
Notre expertise repose sur les enjeux technologiques actuels suivants :Le conseil aux entreprises sur l’architecture, l’exploitation et la gouvernance des donnéesL’accompagnement aux changements et la sensibilisation des métiers à la donnéeLa réalisation de projets sur toutes les briques de la donnéeLes évolutions vers le Cloud.
LE POSTE - Ensemble réalisons de nouveaux projets Talantueux !
Au sein d’équipes projets, vous pourrez être en charge des missions suivantes :Pilotage de projets d’envergure dans des écosystèmes Data/Big Data/CloudCadrage du besoin, conception et analyses fonctionnelle et techniqueBenchmark de solutions et conseil auprès de nos clients sur les solutions technologiques à adopter, en lien avec leurs besoinsConseil sur l’architecture, l’exploitation et la gouvernance des donnéesMaîtrise complète de la plateforme, installation et dimensionnementCréation d’applications, manipulation de la donnée, modélisation et développement de rapports et tableaux de bordRédaction de documentation fonctionnelle et/ou techniqueFormation d’utilisateurs(rices) et équipe projetParticipation à des avant-ventesRéalisation de POC (Proof Of Concept)Être ambassadeur(drice) en participant à des événements partenairesParticipation à des projets internes et partage de connaissances au sein de nos équipes.

Qualifications
VOTRE PROFIL
De formation Bac+5, vous disposez d’une expérience confirmée de minimum 4 ans dans la data et disposez des compétences suivantes :Vous avez développé une expertise technique et fonctionnelle sur l’une des technologies suivantes : MSBI, Power BI, Tableau, Informatica, Talend, Dbt, Hadoop, Spark, Scala, Hive, Kafka, Snowflake, Azure DB, AWS, GCP, Redshift, Athena, TM1, Jedox, Big Query, Looker…Vous maîtrisez les concepts de base de l'informatique décisionnelle (modélisation, alimentation, restitution...) et/ou du big dataVous avez déjà préparé et mené des ateliers métiersVous êtes capable d’appréhender le contexte métierLa connaissance du contrôle de gestion est un plusVous avez formé des utilisateurs et équipes projetUne ou plusieurs certifications seraient fortement appréciéesFrançais lu, écrit, parléL'anglais est un plus.
Votre entourage vous décrit comme…A l’écouteAutonomeAdaptableDynamiqueBon(ne) communiquant(e)Orienté(e) clientCurieux(se)Force de propositionAyant l'esprit d'équipe
Si vous êtes passionné(e) par l’innovation, et souhaitez élargir vos compétences technico-fonctionnelles dans la data, accéder à des fonctions de management de projet et d’équipe, participer au développement commercial et organisationnel, ou tout simplement pouvoir valoriser vos prises d’initiatives et développer de nouveaux terrains de jeux, alors rejoignez-nous !
Avantages :Top 5 du Palmarès Great Place to WorkManagement de proximité par des expertsOrganisation sous forme de communautésUn parcours excellence Agile devopsFinancement de plusieurs certifications officielles à l’année grâce à nos partenaires éditeursUn accès à la plateforme CampusTalan avec plus de 1000 formations disponibles dès votre arrivéeUne mobilité interne facilitéeUn engagement auprès des travailleurs en situation de handicapDes événements et afterworks réguliersSiège parisien situé à Charles-De-Gaulle EtoileTickets restaurants digitalisésMutuelle d’entreprise prise en charge à 100%Prime vacancesPrime de participationPrimes de cooptationActionnariat1% logementPartenaire de l'organisme Mobility dans le cadre de l'accompagnement à la mobilité et à la recherche de logement.
RTT.",
