Lien,Poste,Typedecontrat,Entreprise,Departement,Region,Description,Salaire
https://fr.indeed.com/viewjob?jk=53ebc5186da7f451,DATA INGENIEUR,CDI,Siège de l'AP-HP,75,Île-de-France,"Descriptif
L’AP-HP est un centre hospitalier universitaire à dimension européenne mondialement reconnu.
Ses 39 hôpitaux accueillent chaque année 8 millions de personnes malades : en consultation, en urgence, lors d’hospitalisations programmées ou en hospitalisation à domicile.
Elle assure un service public de santé pour tous, 24h/24.
L’AP-HP est le premier employeur d’Ile de-France : 95 000 personnes – médecins, chercheurs, paramédicaux, personnels administratifs et ouvriers – y travaillent. http://www.aphp.fr

Direction des Systèmes d’Information de l’AP-HP
La Direction des Systèmes d’Information (DSI) a pour mission d'assister le Directeur Général de l'Assistance publique - hôpitaux de Paris dans la conception, le pilotage et la mise en œuvre de la politique système d’information de l'AP-HP. Elle est rattachée au secrétariat général de l’AP-HP.
Sous réserve des attributions propres aux Directions assurant la maîtrise d’ouvrage métier, les missions et domaines de compétences de la DSI sont les suivantes :
La planification et le pilotage général des systèmes d’information ;La préparation des décisions du comité stratégique des systèmes d’information de l’AP-HP, ainsi que des comités de pilotage gestion, patients et innovation et recherche ;L'organisation et l'alignement de la fonction générale « système d'information » sur les objectifs de I'AP-HPLa mesure et la gestion de la performance et des risques liés aux systèmes d'information ;La gestion du portefeuille des projets de systèmes d'information ;La maîtrise d’œuvre des projets informatiques ;La maîtrise d’ouvrage des projets des SI cliniques ;La gestion budgétaire et le contrôle de gestion informatiques ;La gestion prospective des emplois et des ressources humaines affectées aux systèmes d’information ;La coordination des groupes hospitaliers pour le domaine informatique ;La gestion de la sécurité des systèmes d’information.

Le budget d’investissement géré est de près de 70 M€ et le compte d’exploitation est de 150 M€.

Le nombre d’agents de la DSI centrale en équivalents temps pleins est de 435.
POLE


INTITULE
Le pôle Innovation & Données au sein de la DSI

ACTIVITE

Le pôle Innovation et Données, constitué d’environ 100 personnes, a pour missions de réaliser des projets numériques innovants au contact du monde hospitalier. Il est composé de 7 services :

Le service Plateforme Données Massives ayant pour objectifs de consolider, industrialiser et étendre les usages de la plateforme Big Data de l’AP-HP. L’équipe est notamment responsable de l’ingénierie des données, de l’administration de l’infrastructure, et du développement d’outils informatiques permettant l’exploitation des données en adressant les besoins de la recherche, du pilotage et de l’innovation.Le service Recherche et Expertise de Données a pour objectif de consolider la gouvernance institutionnelle des données en lien avec la communauté médicale et de définir la stratégie de standardisation et de mise en qualité des données. Ce domaine a également pour objectif, en lien avec la direction de la recherche clinique, la mise œuvre les solutions et outils nécessaires pour la recherche. L’équipe construit une offre de service à destination des chercheurs et cliniciens afin de permettre l’essor de la recherche sur données et de la recherche clinique à l’AP-HP.Le service Décisionnel – Business Intelligence est en charge de mettre en œuvre les outils de business intelligence pour les besoins de pilotage de l’activité de l’AP-HP. Elle est notamment responsable du développement d’indicateurs, de tableaux de bord et de solutions de data-visualisation pour les équipes de soins et les directions fonctionnelles. Cette équipe aura par ailleurs comme objectifs de stimuler les usages de la donnée au sein des directions stratégiques du siège et des groupes hospitalo-universitaires.Le service Data Science a pour mission de proposer une offre de service de science des données (études épidémiologiques, médico-économiques et développement d’algorithmes d’IA) en appui aux porteurs de projets ou en réponse à des demandes institutionnelles et de développer la recherche technologique permettant l’amélioration des services de la plateforme.Le service Innovation a vocation à accompagner les projets d’innovation autour de la donnée de la DSI et est responsable du Lab Numérique de l’AP-HP permettant d’incuber des projets numériques à forte valeur pour l’institution. L’équipe assure la synergie de ces projets avec le reste de la DSI afin de permettre leur intégration au sein des systèmes d’information de production.La cellule opérationnelle BNDMR, est chargée de poursuivre le projet national confié à l’AP-HP dans le cadre du Plan National Maladies Rares 2. Elle est ainsi responsable du développement de BaMaRa, de l’entrepôt BNDMR, et de l’offre de service aux centres et filières maladies rares.Le service Bio-Informatique s’occupe de la mise en œuvre de la plateforme bio-informatique, MOABI, de l’AP-HP (outils Galaxy, GRoute, Leaves), du déploiement de ces solutions auprès des services de génétique, de la mise en place d’une offre de service bio-informatique externe ainsi que du lien resserré avec le plan France Médecine Génomique et la plateforme SeqOIA.

SERVICE

Description de la Banque Nationale de Données Maladies Rares - BNDMR:

Le 2ème plan national maladies rares (PNMR2) prévoit la création d'une banque nationale de données des maladies rares. Cette action a été reconduite et amplifiée au sein du 3ème plan national (PNMR3).

Ses objectifs sont :
De faire avancer les connaissances sur les maladies rares en France (histoire naturelle des maladies, modes de prise en charge, description de la demande de soins, adéquation de l’offre de soins, économie de la santé, recherche non interventionnelle sur données, etc. ;De favoriser l’identification des patients susceptibles d’être inclus dans des essais cliniques ;De permettre une meilleure coordination entre les structures maladies rares (filières, centres de référence, centre de compétence, etc.).

Afin de remplir ces objectifs, le ministère de la santé (DGOS) a chargé l’AP-HP de la maîtrise d’œuvre du projet BNDMR, autour d’une cellule opérationnelle.
La mission principale consiste à déployer et à assurer la maintenance évolutive du logiciel BaMaRa. Ce logiciel est un système d’information qui permet de recueillir, via une interface web ou des connecteurs, un set minimum de données administratives et cliniques pour les patients atteints de maladies rares. Hébergé par l’AP-HP, ce système d’information est mis à disposition des établissements de santé partenaires du projet, dans le cadre d’une convention de partenariat avec l’AP-HP.

Outre cette mission principale, la cellule opérationnelle BNDMR est chargée de structurer un environnement réglementaire, une gouvernance et un dispositif technique de type « entrepôt de données » pour organiser l’exploitation multicentrique des données issues de BaMaRa, en complément des données d’autres sources, à des fins de recherche, de pilotage et d’innovation.

COMPOSITION DE L’EQUIPE :

La cellule opérationnelle est composée d’un directeur, ainsi que de 16 professionnels spécialisés en systèmes d’information et/ou conduite de projet et/ou en exploitation de données/santé publique. La cellule opérationnelle a également recours, ponctuellement, à des prestations externes, des stagiaires et des apprentis.

LIAISONS

HIERARCHIQUE

Chief Data Officer

FONCTIONNELLES

Equipes Data, sous la responsabilité du Data ArchitectFonctionnelle et Techniques de la Cellule opérationnelle BNDMRRéférente médicale BNDMRProfessionnels de santé et porteurs de projetLaboratoires de recherche publics et privés.

ACTIVITES

L’équipe Data de la BNDMR se compose comme suit :
Une Chief Data OfficerUn Data ArchitectUn Référent DataUn Senior Data ScientistUne Data Manageuse

Dans une perspective d’exploitation et de valorisation des données des maladies rares, la CO BNDMR met en place un Entrepôt de Données de Santé (EDS) qui intègre les données issues de BaMaRa, la base de données de déclaration des activités de soins dans les centres maladies rares.

Comme socle technique de ce projet, la BNDMR a investi dans deux nouvelles machines dont un serveur de calcul avec GPU qui seront intégrées dans le cluster Kubernetes de l’AP-HP.

L’EDS BNDMR cible se base sur un écosystème en plusieurs couches data : raw data layer dans laquelle sont déposées les sources non transformées, un bus de datamarts et enfin une datavisualisation.

Les choix du modèle de données, l’architecture technique et l’outil de data visualisation de l’EDS ont été qualifiés et validés par le Data Architect. La feuille de route pour la mise en production reste conditionnée par l’évolution de l’infrastructure de l’équipe et le passage vers un environnement Kubernetes pour le déploiement et l’exploitation de ses applicatifs.
Dans ce contexte, et sous la responsabilité du Data Architect, nous recherchons un data engineer avec des compétences en DataOps pour assurer les missions suivantes :

Missions DataOps:
Containerisation et orchestration (Docker, Kubernetes)Industrialisation des processus en CI/CD (Gitlab)Monitoring et administration de bases de données (PostgreSQL, MongoDB)

Missions Data engineer:

Participer à la mise en place, l’évolution et la maintenance des datamart.Designer des data pipelines et gérer toutes l’intégration des flux de donnéesGestion de l’ETL as a script via PythonOrchestration & monitoring des pipelines ETL (Airflow ou Gitlab, en cours de prototypage)

QUOTITE

Temps plein - 100 %

HORAIRES DE TRAVAIL

Forfait jours

COMPETENCES REQUISES

Savoir-faire requis
Solides compétences en programmation et en automatisation dans un environnement LinuxBonne expertise sur les technologies « DataOps » Docker, Gitlab (versionning et CI/CD), Kubernetes, AirflowExpérience avec l’administration des bases de données (SQL [PostgreSQL], NoSQL [MongoDB])Bonnes compétences en Python (incl. Pandas) et SQLBases en RéseauxConnaissances des différents formats de fichier de données standard (JSON, XML, CSV …).

Connaissances associées

Notions d’architecture data de type BI (datawarehousing, ETL/ELT, datamarts) et des problématiques associées : modélisations en formes normales et dimensionnelle, historisation, gestion des données de référence.Connaissances ou intérêt pour la data visualisation en BI (Cognos)Curiosité pour le métier de la santé et les données associéesSensibilité aux pratiques régies par le RGPD et des orientations et doctrines CNIL sur la protection des données de santé

Qualités requises

Capacité à maîtriser rapidement les nouvelles technologiesAptitude à travailler en équipe, à s’adapter aux contraintes
Autonomie et sens de la responsabilitéSens de l’organisation, rigueur et respect des délaisConfidentialité : soumis au secret professionnel dans le cadre des données à gérer

PRE-REQUIS

De formation bac+4/5 IT (école d’ingénieur ou université) dans un domaine lié à la Data, vous avez une première expérience (alternance ou 1er emploi) dans le domaine de l’administration des technologies big data ou BI.Adhésion aux valeurs du service public et intérêt prononcé pour le domaine de la santé
Personne à contacter
Monsieur SANDRIN Arnaud

Email : arnaud.sandrin@aphp.fr",
https://fr.indeed.com/viewjob?jk=690e7a7554b4b573,DATA INGENIEUR,CDI,gfi,93,Île-de-France,"Mission
Dans le cadre de sa forte croissance Inetum (anciennement Gfi) recrute un Data Engineer (H/F) pour sa practice Smart Data Analytics.
L’offre SDA propose à ses clients un accompagnement de bout en bout (cadrage, dimensionnement socle technique jusqu’à la réalisation) des projets BI & Big Data avec une approche Data Driven.

Directement rattaché au directeur de la Business Unit vous serez amené à :
Accompagner nos clients dans la réalisation de projets dans un contexte Big Data et Cloud,

Cela consiste à :
Participer à des POCs (Proof Of Concept) permettant de valider les principes techniques et algorithmiques pour des projets,
Développer des applications d’injection et de traitements massifs sur des volumétries importantes dans les langages Python ou Java et Scala,
Participer à l’industrialisation d’applications partiellement réalisées (optimisation du code, optimisation des performances, utilisation maximisée des possibilités des outils et du cluster disponible),
Travailler dans un contexte Agile,

Profil
Vous êtes un ingénieur ayant évolué dans le monde du développement (langages java, scala, python) avec une culture Devops, une maîtrise des BDD, du Shell/Unix…

Vous avez 2 à 3 ans d'expérience confirmée développement, une expérience a minima sur une distribution Hadoop (Cloudera, Horthonworks ou MAP-R). Vous êtes à l’aise avec les principes du cloud, une première expérience avec l’un des cloud provider suivant : AWS, Azure, GCP serait un plus...

Vous avez un esprit curieux, orienté sur la mise en place d’algorithmes de manipulation de données volumineuses, sur la manière de les rendre plus performantes (parallélisation, distribution de charge) et dans des conditions de hautes disponibilités.

Vous appréciez le travail en équipe, vous aimez les challenges et les enjeux techniques vous passionnent.

Votre curiosité intellectuelle et technologique, liée à vos excellentes qualités de communication, vous amène naturellement à partager vos connaissances avec vos clients, vos collaborateurs

Pourquoi nous rejoindre ?
Vous rejoindrez un pôle d’experts Big Data, dans un esprit « start-up » au sein d’un grand groupe international, disposant de matériels spécifiques et dédiés à la réalisation de projets innovants,
Vous évoluerez, avec une forte autonomie, dans un environnement bienveillant où vous pourrez échanger, partager et grandir à travers des missions variées (nature des projets, secteur d’activité de nos clients, en IDF ou en régions, …) … chez Inetum la connaissance est partagée (apprendre à donner et recevoir du feedback)
Vous bénéficierez d’un parcours de formation individualisé
Organisation
Nous sommes une ESN agile et un groupe international. A l'ère de la post-transformation digitale, nous mettons tout en œuvre pour que chacun de nos 27 000 collaborateurs puisse se renouveler perpétuellement, en vivant positivement son propre flow digital. Chacun d'entre eux peut ainsi façonner son parcours de carrière selon ses appétences, entreprendre de manière pragmatique avec ses clients pour un monde plus positif, innover localement dans 26 pays et harmoniser son investissement professionnel et son bien-être personnel.
Rejoignez Inetum. Vivez votre flow digital positif.

Tous nos postes sont ouverts aux personnes en situation de handicap.
Pays
France
Emplacement
145 Boulevard Victor Hugo 93400 Saint-Ouen
Type de contrat
CDI",
https://fr.indeed.com/viewjob?jk=79b37928e2f1550f,0,CDI,Informatica,75,Île-de-France,"Domain Expert, Data Governance & Privacy

Provides an in-depth knowledge of specific product domains in combination with adept business acumen to field sales teams, prospects, partners, customers, and internal stakeholders. Promotes and enhances Informatica's reputation across all industry verticals as a trusted advisor for the supported domain. Closely ties business value to technical solutions for customers to expand the landing, adoption, expansion, and renewal of represented domain solutions. Navigates quickly evolving markets, dynamic competitive environments, and unsettled technology landscapes to establish the company as a leader in the subject domain area.
Essential Duties & Responsibilities
Partners with sales, pre-sales, and marketing to communicate the value of subject product domain with emphasis on business-impacts of the solution.
Leads conversations with the customer on subject domain expertise to Land, Adopt/Expand product footprints, and Retain customers.
Support field enablement to develop and deliver compelling content
Collaborate with field marketing to promote designated product domain.
Provide competitive intelligence via grasp of the competition and marketplace for the subject product domain.
Research, document, and communicate competitive offerings in rapidly evolving solution areas
Support key partner firms in enablement, sales, and marketing activities for a product domain
Understand customer capacity requirements to assist sales teams with pricing and packaging complex, multi-product deal packages
Conduct interactive sales workshops with prospects to uncover need and align solutions in compelling ways
Produce qualitative and quantitative business cases in support of complex enterprise sales cycles.
Timely documentation within CRM / Marketing software, as applicable, of customer contact and activity data is required of this role (e.g. names, titles, contact information, opportunity value, product information, sales stages, probability, business pain, firm-future commitments, etc.)
At this level, incumbents are expected to lead the discussion with customer decision makers in the subject product domain area at senior executive and/or CXO levels.
Communicates to key internal stakeholders at senior executive levels on emerging trends in subject domain area
Drives solutions to more complex business problems with both domain-related and/or more broad company product suite offerings.
Knowledge & Skills
Holds broad expertise or unique knowledge to contribute to development of company objectives or to achieve goals in creative and effective ways.
Extensive industry knowledge and understanding of a customer’s decision-making process, goals, strategies, and business objectives.
Exhibits confidence and expertise with presentations, customer service, financial/business acumen, and negotiation skills at all levels of customer engagement.
Holds a complete understanding and can articulate upon the business and technical contexts of key accounts.
Authoritative leader by example on accounts and compels others to get on board.
Mentors others at consultative effectiveness and establishing trust with internal and external customers.
Deep knowledge of hybrid deployment of software solutions, Data Warehousing, Database, and/or Business Intelligence software concepts and products.
Education/Experience
BA/BS or equivalent educational background is preferred.
Minimum 12+ years of relevant professional experience.
#LI-JC1

Where data is poised for greatness
A career with Informatica gives you all the opportunities and benefits that can only come from working for the trusted industry leader. By joining our team, you'll be able to solve real-life problems, make a difference, have a global impact, and join a supportive group of globally diverse teammates. We encourage you to be yourself, grow with us and help us create a world where data is poised for greatness.",
https://fr.indeed.com/viewjob?jk=75b919336f961157,DATA SCIENTIST,CDI,CS Novidy's,92,Île-de-France,"SOCIÉTÉ

La société CS Novidy's est spécialisée dans les solutions et les services Cyber-sécurité et Transformation de l'IT. Sa taille intermédiaire et son expérience permettent à CS Novidy's d'accompagner ses clients sur des projets à la fois dimensionnants et innovants techniquement, et qui requièrent une très grande flexibilité.

 CS Novidy’s est filiale de CS Group, spécialisé dans l’intégration de systèmes critiques cyber protégés.

En combinant l'expertise et le dynamisme de CS Novidy’s, notamment en matière de certifications PASSI, avec les atouts dont dispose CS Group, en particulier par ses relations avec les Opérateurs d’Importance Vitale, l’ANSSI, et autres instances gouvernementales, CS Novidy's a renforcé son offre de services et sa notoriété sur le marché de la Cyber sécurité.

Avec désormais plus de 200 experts SSI, ce rapprochement avec CS Group a permis de gagner au minimum deux ans sur le plan de développement de l'entreprise, au plus grand bénéfice des clients et des collaborateurs.

Le groupe accompagne ses clients dans les phases de conseil, d'intégration systèmes et de solutions de sécurité, de prestation de services, d'accompagnement au travers de son SOC/NOC et de son Assistance Opérationnelle 24h/24, ou de ses Centres de Services. Les 200 experts et consultants du groupe sont répartis en Île de France, en Région Grand Ouest, en Région Nord, en U.K, et en Inde.

MISSION

En tant qu’Ingénieur cybersécurité & Data Scientist, vous vous inscrivez dans la réalisation et l’innovation de solutions d’analyse et de recherche de menaces dans le Big data.

Vous contribuez à la réalisation de nos projets de Cybersécurité et de R&D dans des contextes nationaux et internationaux.

Vos principales missions :

Définir les problèmes à résoudre ;

Acquérir, analyser et explorer les données ;

Extraire des caractéristiques pour l'entraînement du modèle ;

Choisir ou construire un modèle d’apprentissage adapté au problème et aux données ;

Entraîner, évaluer et optimiser l'algorithme d'apprentissage ;

Tester l’efficacité du modèle ;

Déployer le modèle pour faire des prédictions ;

Collaborer de manière active avec nos équipes SOC/NOC, Conseil & Audit et Pen-tester.

PROFIL

Grâce à votre expérience en développement, vous maîtrisez les langages de programmation Python, C/C++, Shell et Bash et comme scientifique des données vous êtes capable de coder, de créer des prototypes de machine learning, et de les intégrer aux systèmes de données complexes. Parmi les principaux langages associés à cette science des données, on comptera particulièrement sur votre capacité à développer en SQL, Python, R, et SAS.

En périphérie, un plus serait la connaissance de Java, Scala, et Julia.

Par ailleurs, les données exploitées sont structurées dans de nombreux formats et standards. Une connaissance de MITRE ATT&CK, OpenCTI, IODEF et IDMEF du SIEM Prelude, est un plus.

Vous êtes passionné, aimez creuser les sujets qui vous intéressent et vous êtes attentifs à la qualité de votre code. Également, vous êtes force de proposition et savez travailler en équipe.

Ref : hfbxjy525h",
https://fr.indeed.com/viewjob?jk=5fff21a6f7374010,DATA INGENIEUR,CDI,COEXYA,75,Île-de-France,"Il a pour missions principales de développer les projets Big Data demandés par le métier, et notamment : Passer de la donnée brute à de la donnée exploitable, exposée sous forme de tables requetables dans le datalake (inférer les schémas de données, nettoyer et normaliser les données, publier les données) Consolider ces données au fur et à mesure de leur alimentation récurrente dans le data lake Les exploiter pour atteindre la finalité business (exposition de business view, réintégration des résultats dans le SI, service de scoring, ) De travailler à la création du socle technique Big Data (librairies de fonctions, features communément utilisées avec les data scientists ) et industrialiser le cycle de développement de l'équipe",
